{
  "schema_id": "citrus.recording_observation_finalized_receipt",
  "schema_version": 3,
  "canonicalization": "canonical_json_utf8_sort_keys_compact_v1",
  "receipt_id": "obsbindfin_dcfacd424dbc144baa8593b3b0dfdec1a8b6ed68c5e595dd4924d3ed006155a3",
  "contract_sha256": "sha256:dcfacd424dbc144baa8593b3b0dfdec1a8b6ed68c5e595dd4924d3ed006155a3",
  "contract": {
    "schema_id": "citrus.recording_observation_finalized_receipt",
    "schema_version": 3,
    "request_id": "obsbindreq_1111111111111111111111111111111111111111111111111111111111111111",
    "request_contract_sha256": "sha256:4444444444444444444444444444444444444444444444444444444444444444",
    "acceptance_id": "obsbindacc_1111111111111111111111111111111111111111111111111111111111111111",
    "acceptance_contract_sha256": "sha256:6666666666666666666666666666666666666666666666666666666666666666",
    "observation_context_id": "obsctx_1111111111111111111111111111111111111111111111111111111111111111",
    "finalized_at_utc": "2026-10-10T00:05:00Z",
    "citrus_experiment_id": "citexp_2222222222222222222222222222222222222222222222222222222222222222",
    "citrus_session_uuid": "citsess_1111111111111111111111111111111111111111111111111111111111111111",
    "target": {
      "rig_id": "fixture-rig",
      "canvas_name": "fixture",
      "arena_id": "arena_1",
      "camera_id": "02010093",
      "source_camera_stream_id": "02010093"
    },
    "h5_artifact": {
      "relative_path": "citrus/citsess_1111111111111111111111111111111111111111111111111111111111111111_snow_1h.h5",
      "size_bytes": 78,
      "sha256": "sha256:77168fd06beef8150dcecbcc399335babf10a0950f3af2f02f34831e8f35b835"
    },
    "session_status": "COMPLETE",
    "runtime_geometry_contract_sha256": "sha256:8888888888888888888888888888888888888888888888888888888888888888",
    "protocol_semantic": {
      "status": "available",
      "semantic_sha256": "sha256:9999999999999999999999999999999999999999999999999999999999999999"
    },
    "citrus_artifacts": [],
    "subject_reference": {
      "schema_id": "citrus.subject_reference",
      "schema_version": 1,
      "dish_id": "19234_2",
      "lookup_status": "collected",
      "lookup_reason": null,
      "lookup_http_status": null,
      "queried_at_utc": "2026-10-09T21:20:42Z",
      "dish": null,
      "fish_status": "not_collected",
      "fish_reason": "operator_did_not_select",
      "fish": null,
      "subject_id": "061346be-666a-49f3-8b95-9f0eb352bf3a",
      "subject_type": "individual",
      "subject_count": 1,
      "zebrobot_version": null,
      "source": "citrus_mzb_lookup"
    }
  }
}
